{
  "id": "dart_monkey",
  "name": "Dart Monkey",
  "category": "primary",
  "cost": 200,
  "placement": "land",
  "footprint": {
    "radius": 6
  },
  "game_version": "stats last updated for 55.1 per wiki Stats page; latest BTD6 version on wiki: 57.4",
  "sources": [
    "https://www.bloonswiki.com/Dart_Monkey_(BTD6)",
    "https://www.bloonswiki.com/Stats:Dart_Monkey_(BTD6)",
    "https://www.bloonswiki.com/Special:CargoTables/btd6_upgrades"
  ],
  "abilities": [
    {
      "name": "Super Monkey Fan Club",
      "cooldown": 50,
      "description": "Unlocked by Super Monkey Fan Club (middle path tier 4). In-game text: Super Monkey Fan Club Ability: Converts up to 10 nearby Dart Monkeys including itself into Super Monkeys for 15 seconds. Regular attack speed also increased. wiki stats: Buff {Cooldown modifier: ×0.0632; Projectile radius override: 2 unit(s); Lifespan: 15s}"
    },
    {
      "name": "Plasma Monkey Fan Club",
      "cooldown": 50,
      "description": "Unlocked by Plasma Monkey Fan Club (middle path tier 5). In-game text: Elite membership of this club grants the Dart Monkeys even more power! wiki stats: Buff {Cooldown modifier: ×0.0316; Damage bonus: +1; Pierce bonus: +3; Damage type override: Plasma [Cannot damage Purple or Glass]; Projectile radius override: 6 unit(s); Lifespan: 15s}"
    }
  ],
  "base": {
    "range": 32,
    "camo": false,
    "reach": "radius",
    "attacks": [
      {
        "tag": "dart",
        "name": "dart",
        "damage": 1,
        "pierce": 2,
        "cooldown": 0.95,
        "damage_type": "sharp",
        "projectiles": 1,
        "blast_radius": null,
        "projectile_speed": 300,
        "lifespan": 0.25,
        "camo": false,
        "notes": "cannot target Camo; wiki stats: Cooldown: 0.95s; Targeting range: 32 units; Filters: Cannot target Camo; Projectile {Pierce: 2; Damage: 1; Damage type: Sharp [Cannot damage Lead or frozen]; Speed: 300 units/s; Lifespan: 0.25s; Radius: 2 units; Filters: Cannot hit Camo}",
        "damage_vs": {}
      }
    ]
  },
  "paths": {
    "top": [
      {
        "tier": 1,
        "name": "Sharp Shots",
        "cost": 140,
        "description": "Can pop 1 extra Bloon per shot.",
        "state": {
          "range": 32,
          "camo": false,
          "reach": "radius",
          "attacks": [
            {
              "tag": "dart",
              "name": "dart",
              "damage": 1,
              "pierce": 3,
              "cooldown": 0.95,
              "damage_type": "sharp",
              "projectiles": 1,
              "blast_radius": null,
              "projectile_speed": 300,
              "lifespan": 0.25,
              "camo": false,
              "notes": "cannot target Camo; wiki stats: Cooldown: 0.95s; Targeting range: 32 units; Filters: Cannot target Camo; Projectile {Pierce: 3; Damage: 1; Damage type: Sharp [Cannot damage Lead or frozen]; Speed: 300 units/s; Lifespan: 0.25s; Radius: 2 units; Filters: Cannot hit Camo}",
              "damage_vs": {}
            }
          ]
        },
        "effects": {}
      },
      {
        "tier": 2,
        "name": "Razor Sharp Shots",
        "cost": 200,
        "description": "Can pop 2 more Bloons per shot.",
        "state": {
          "range": 32,
          "camo": false,
          "reach": "radius",
          "attacks": [
            {
              "tag": "dart",
              "name": "dart",
              "damage": 1,
              "pierce": 5,
              "cooldown": 0.95,
              "damage_type": "sharp",
              "projectiles": 1,
              "blast_radius": null,
              "projectile_speed": 300,
              "lifespan": 0.25,
              "camo": false,
              "notes": "cannot target Camo; wiki stats: Cooldown: 0.95s; Targeting range: 32 units; Filters: Cannot target Camo; Projectile {Pierce: 5; Damage: 1; Damage type: Sharp [Cannot damage Lead or frozen]; Speed: 300 units/s; Lifespan: 0.25s; Radius: 2 units; Filters: Cannot hit Camo}",
              "damage_vs": {}
            }
          ]
        },
        "effects": {}
      },
      {
        "tier": 3,
        "name": "Spike-o-pult",
        "cost": 320,
        "description": "Converts the Dart Monkey into a slower attacking Spike-o-pult that hurls large spiked balls. Each ball can pop lots of Bloons and rebounds off obstacles.",
        "state": {
          "range": 36.8,
          "camo": false,
          "reach": "radius",
          "attacks": [
            {
              "tag": "dart",
              "name": "dart",
              "damage": 2,
              "pierce": 18,
              "cooldown": 1.15,
              "damage_type": "shatter",
              "projectiles": 1,
              "blast_radius": null,
              "projectile_speed": 150,
              "lifespan": 1,
              "camo": false,
              "notes": "cannot target Camo; wiki stats: Cooldown: 1.15s; Targeting range: 36.8 units; Filters: Cannot target Camo; Projectile {Pierce: 18; Damage: 2; Damage type: Shatter [Cannot damage Lead]; Speed: 150 units/s; Lifespan: 1s; Radius: 5 units; Filters: Cannot hit Camo}",
              "damage_vs": {}
            }
          ]
        },
        "effects": {}
      },
      {
        "tier": 4,
        "name": "Juggernaut",
        "cost": 1800,
        "description": "Hurls a giant spiked ball that pops Lead and excels at crushing Ceramic and Fortified Bloons.",
        "state": {
          "range": 36.8,
          "camo": false,
          "reach": "radius",
          "attacks": [
            {
              "tag": "dart",
              "name": "dart",
              "damage": 2,
              "pierce": 60,
              "cooldown": 1,
              "damage_type": "normal",
              "projectiles": 1,
              "blast_radius": null,
              "projectile_speed": 300,
              "lifespan": 1,
              "camo": false,
              "notes": "cannot target Camo; wiki stats: Cooldown: 1s; Targeting range: 36.8 units; Filters: Cannot target Camo; Projectile {Pierce: 60; Damage: 2; Damage to Ceramic: +3; Damage to Fortified: +2; Damage type: Normal [Can damage any Bloon type]; Speed: 300 units/s; Lifespan: 1s; Radius: 7 units; Filters: Cannot hit Camo; Knockback {Multiplier: ×-3; Multiplier for Lead: ×-1; Multiplier for Ceramic: ×-1; Multiplier for MOAB-Class: ×1; Duration: 0.15s}}",
              "damage_vs": {
                "ceramic": 3,
                "fortified": 2
              }
            }
          ]
        },
        "effects": {}
      },
      {
        "tier": 5,
        "name": "Ultra-Juggernaut",
        "cost": 15000,
        "description": "Gigantic spiked ball splits twice into 6 Juggernaut balls for even more destructive power against Ceramic, Fortified and Lead Bloons.",
        "state": {
          "range": 36.8,
          "camo": false,
          "reach": "radius",
          "attacks": [
            {
              "tag": "dart",
              "name": "dart",
              "damage": 5,
              "pierce": 210,
              "cooldown": 1,
              "damage_type": "normal",
              "projectiles": 1,
              "blast_radius": null,
              "projectile_speed": 300,
              "lifespan": 1,
              "camo": false,
              "notes": "cannot target Camo; wiki stats: Cooldown: 1s; Targeting range: 36.8 units; Filters: Cannot target Camo; Projectile {Pierce: 210; Damage: 5; Damage to Lead: +20; Damage to Ceramic: +8; Damage to Fortified: +5; Damage type: Normal [Can damage any Bloon type]; Speed: 300 units/s; Lifespan: 1s; Radius: 9 units; Filters: Cannot hit Camo; Knockback {Multiplier: ×-3; Multiplier for Lead: ×-1; Multiplier for Ceramic: ×-1; Multiplier for MOAB-Class: ×1; Duration: 0.15s}}; Mini-projectile {Count: 6; Angle: 360°; Pierce: 50; Damage: 2; Damage to Ceramic: +3; Damage to Fortified: +2; Damage type: Normal [Can damage any Bloon type]; Speed: 150 units/s; Lifespan: 1s; Radius: 7 units; Filters: Cannot hit Camo}",
              "damage_vs": {
                "lead": 20,
                "ceramic": 8,
                "fortified": 5
              }
            }
          ]
        },
        "effects": {}
      }
    ],
    "middle": [
      {
        "tier": 1,
        "name": "Quick Shots",
        "cost": 100,
        "description": "Shoots 15% faster.",
        "state": {
          "range": 32,
          "camo": false,
          "reach": "radius",
          "attacks": [
            {
              "tag": "dart",
              "name": "dart",
              "damage": 1,
              "pierce": 2,
              "cooldown": 0.8075,
              "damage_type": "sharp",
              "projectiles": 1,
              "blast_radius": null,
              "projectile_speed": 300,
              "lifespan": 0.25,
              "camo": false,
              "notes": "cannot target Camo; wiki stats: Cooldown: 0.8075s; Targeting range: 32 units; Filters: Cannot target Camo; Projectile {Pierce: 2; Damage: 1; Damage type: Sharp [Cannot damage Lead or frozen]; Speed: 300 units/s; Lifespan: 0.25s; Radius: 2 units; Filters: Cannot hit Camo}",
              "damage_vs": {}
            }
          ]
        },
        "effects": {}
      },
      {
        "tier": 2,
        "name": "Very Quick Shots",
        "cost": 190,
        "description": "Shoots 33% faster!",
        "state": {
          "range": 32,
          "camo": false,
          "reach": "radius",
          "attacks": [
            {
              "tag": "dart",
              "name": "dart",
              "damage": 1,
              "pierce": 2,
              "cooldown": 0.6365,
              "damage_type": "sharp",
              "projectiles": 1,
              "blast_radius": null,
              "projectile_speed": 300,
              "lifespan": 0.25,
              "camo": false,